{
  "schema_version": "2.0",
  "provider": "minio",
  "event_ts": "2024-01-15T14:00:00.000Z",
  "bucket": "engram-artifacts",
  "object_key": "scm/1/git/commits/old-file.diff",
  "operation": "s3:DeleteObject",
  "status_code": 204,
  "success": true,
  "request_id": "REQ-DELETE-001",
  "principal": "ops-admin",
  "remote_ip": "192.168.1.50",
  "user_agent": "boto3/1.26.0",
  "bytes_sent": 0,
  "bytes_received": 0,
  "duration_ms": 10,
  "raw": {
    "version": "1",
    "deploymentid": "prod-deployment",
    "time": "2024-01-15T14:00:00.000Z",
    "api": {
      "name": "DeleteObject",
      "bucket": "engram-artifacts",
      "object": "scm/1/git/commits/old-file.diff",
      "statusCode": 204
    }
  }
}
